{
  "schema_version": "1.0.0",
  "policy_version": 12,
  "daily_limit_minutes": 30,
  "allowed_categories": [
    "story"
  ],
  "disabled_periods": [
    {
      "start_time": "21:00",
      "end_time": "07:00"
    }
  ],
  "max_volume_percent": 55,
  "source_child_count": 2,
  "aggregation_mode": "most_restrictive",
  "updated_at": "2026-10-04T00:00:00Z"
}
